{
  "$schema": "http://json-schema.org/schema#",
  "type": "object",
  "properties": {
    "id": { "type": "string" },
    "firstName": { "type": "string" },
    "lastName": { "type": "string" },
    "title": { "type": "string" },
    "address": { "type": "string" },
    "city": { "type": "string" },
    "province": { "type": "string" }
  },
  "required": [ "id", "firstName", "lastName", "title", "address", "city", "province" ]
}
