[
    {
        "id": "1",
        "firstName": "Amy",
        "lastName": "Jones",
        "title": "Sales Representative",
        "address": "372 Harbord Street",
        "city": "Toronto",
        "province": "Ontario"
    },
    {
        "id": "2",
        "firstName": "James",
        "lastName": "King",
        "title": "President and CEO",
        "address": "2 Bloor Street East",
        "city": "Toronto",
        "province": "Ontario"
    },
    {
        "id": "3",
        "firstName": "Ray",
        "lastName": "Moore",
        "title": "Vice President of Sales",
        "address": "375 Church Street",
        "city": "Mississauga",
        "province": "Ontario"
    },
    {
        "id": "4",
        "firstName": "John",
        "lastName": "Williams",
        "title": "Vice President of Engineering",
        "address": "237 Dundas Street East",
        "city": "Brampton",
        "province": "Ontario"
    },
    {
        "id": "5",
        "firstName": "Joe",
        "lastName": "Doe",
        "title": "Sales Representative",
        "address": "3023 Parkerhill Road",
        "city": "Mississauga",
        "province": "Ontario"
    }
]
